{
  "Table": "Patient",
  "Action": "",
  "RxSys_PatID": "",
  "LastName": "",
  "FirstName": "",
  "MiddleInitial": "",
  "Address1": "",
  "Address2": "",
  "City": "",
  "State": "",
  "Zip": "",
  "Phone1": "",
  "Phone2": "",
  "WorkPhone": "",
  "RxSys_LocID": "",
  "Room": "",
  "Comments": "",
  "CycleDate": "",
  "CycleDays": "",
  "CycleType": "",
  "Status": "",
  "RxSys_LastDoc": "",
  "RxSys_PrimaryDoc": "",
  "RxSys_AltDoc": "",
  "SSN": "",
  "Allergies": "",
  "Diet": "",
  "DxNotes": "",
  "TreatmentNotes": "",
  "DOB": "",
  "Height": "",
  "Weight": "",
  "ResponsibleName": "",
  "InsName": "",
  "InsPNo": "",
  "AltInsName": "",
  "AltInsPNo": "",
  "MCareNum": "",
  "MCaidNum": "",
  "AdmitDate": "",
  "ChartOnly": "",
  "Gender": ""
}
